{
  "actualResourceUse": {
    "costUsd": "0.01",
    "inputTokens": 900,
    "outputTokens": 60,
    "toolCalls": 1,
    "wallClockSeconds": 2
  },
  "allowedMounts": [],
  "conditionArm": "degenerate",
  "contractDigest": "sha256:c12ee9ec8073138abf24b9a29613a7613d8b042b9878a7d8c408cb3cd465264b",
  "contractId": "checklist-selection",
  "evaluatorConfigurationDigest": "sha256:208d69378961bae033d87c2dde36d89feac96ae55c0d9e7041e642dd7a0127b4",
  "forbiddenInputAccounting": {
    "builder-transcript": {
      "note": null,
      "withheld": true
    },
    "comparator-results": {
      "note": null,
      "withheld": true
    },
    "human-labels": {
      "note": null,
      "withheld": true
    },
    "implementation-logs": {
      "note": null,
      "withheld": true
    },
    "original-spec": {
      "note": null,
      "withheld": true
    },
    "repository": {
      "note": null,
      "withheld": true
    },
    "source-code": {
      "note": null,
      "withheld": true
    }
  },
  "modelSnapshot": "tutorial-deterministic-evaluator",
  "networkAllowlist": [],
  "observedMounts": [],
  "observedNetworkTargets": [],
  "observedToolCalls": [],
  "parentDigest": null,
  "resourceCeilings": {
    "maxCostUsd": "1.00",
    "maxInputTokens": 100000,
    "maxOutputTokens": 100000,
    "maxToolCalls": 20,
    "maxWallClockMinutes": 5
  },
  "revisionCount": 0,
  "runId": "skill-degenerate-1",
  "schemaVersion": 1,
  "systemPromptDigest": "sha256:e2623f778b36d098c63a4b21afdc3f796234b23b62c8ddfdb34a356286862956",
  "toolAllowlist": [],
  "violation": null,
  "workspaceIdentity": "tutorial-workspace"
}
