{
  "actualResourceUse": {
    "costUsd": "0.01",
    "inputTokens": 1200,
    "outputTokens": 200,
    "toolCalls": 3,
    "wallClockSeconds": 4
  },
  "allowedMounts": [],
  "conditionArm": "mutated",
  "contractDigest": "sha256:edfde75db27ba1d3a017265b9cf054f2731c1a3f046c5bbd67f61024ca3a99bd",
  "contractId": "tutorial-notes-api",
  "evaluatorConfigurationDigest": "sha256:fe4f70ba3f8a346796ecccda074b587782f3239cab62513d23e64e92a5d195a5",
  "forbiddenInputAccounting": {
    "builder-transcript": {
      "note": null,
      "withheld": true
    },
    "comparator-results": {
      "note": null,
      "withheld": true
    },
    "human-labels": {
      "note": null,
      "withheld": true
    },
    "implementation-logs": {
      "note": null,
      "withheld": true
    },
    "original-spec": {
      "note": null,
      "withheld": true
    },
    "repository": {
      "note": null,
      "withheld": true
    },
    "source-code": {
      "note": null,
      "withheld": true
    }
  },
  "modelSnapshot": "tutorial-deterministic-evaluator",
  "networkAllowlist": [
    "notes-api"
  ],
  "observedMounts": [],
  "observedNetworkTargets": [
    "notes-api"
  ],
  "observedToolCalls": [],
  "parentDigest": null,
  "resourceCeilings": {
    "maxCostUsd": "0.25",
    "maxInputTokens": 100000,
    "maxOutputTokens": 100000,
    "maxToolCalls": 20,
    "maxWallClockMinutes": 5
  },
  "revisionCount": 0,
  "runId": "notes-run-1",
  "schemaVersion": 1,
  "systemPromptDigest": "sha256:e2623f778b36d098c63a4b21afdc3f796234b23b62c8ddfdb34a356286862956",
  "toolAllowlist": [],
  "violation": null,
  "workspaceIdentity": "tutorial-workspace"
}
