{
  "actualResourceUse": {
    "costUsd": "0.01",
    "inputTokens": 900,
    "outputTokens": 60,
    "toolCalls": 1,
    "wallClockSeconds": 2
  },
  "allowedMounts": [],
  "conditionArm": "clean",
  "contractDigest": "sha256:5eb9a97ec666c68dfb12e9c512422b9cb50a57c407257a0287332d30bfcc6989",
  "contractId": "checklist-selection",
  "evaluatorConfigurationDigest": "sha256:7f8160adfe5c410ef8358df691ce4f2881bd4ac3253604c21363928c5fff9277",
  "forbiddenInputAccounting": {
    "builder-transcript": {
      "note": null,
      "withheld": true
    },
    "comparator-results": {
      "note": null,
      "withheld": true
    },
    "human-labels": {
      "note": null,
      "withheld": true
    },
    "implementation-logs": {
      "note": null,
      "withheld": true
    },
    "original-spec": {
      "note": null,
      "withheld": true
    },
    "repository": {
      "note": null,
      "withheld": true
    },
    "source-code": {
      "note": null,
      "withheld": true
    }
  },
  "modelSnapshot": "tutorial-deterministic-evaluator",
  "networkAllowlist": [],
  "observedMounts": [],
  "observedNetworkTargets": [],
  "observedToolCalls": [],
  "parentDigest": null,
  "resourceCeilings": {
    "maxCostUsd": "1.00",
    "maxInputTokens": 100000,
    "maxOutputTokens": 100000,
    "maxToolCalls": 20,
    "maxWallClockMinutes": 5
  },
  "revisionCount": 0,
  "runId": "skill-honest-1",
  "schemaVersion": 1,
  "systemPromptDigest": "sha256:e2623f778b36d098c63a4b21afdc3f796234b23b62c8ddfdb34a356286862956",
  "toolAllowlist": [],
  "violation": null,
  "workspaceIdentity": "tutorial-workspace"
}
