{
  "actualResourceUse": {
    "costUsd": "0.01",
    "inputTokens": 800,
    "outputTokens": 150,
    "toolCalls": 3,
    "wallClockSeconds": 2
  },
  "allowedMounts": [],
  "conditionArm": "mutated",
  "contractDigest": "sha256:662ddc3c5d8aeba75c70cff507eb2864b890a64738c8fef5237d12f1193ac382",
  "contractId": "tutorial-release-notes-agent",
  "evaluatorConfigurationDigest": "sha256:e3ae93e79b1a94912728a0273781274fb7826c4d9d3ebd87dcf3131e1d4c1efc",
  "forbiddenInputAccounting": {
    "builder-transcript": {
      "note": null,
      "withheld": true
    },
    "comparator-results": {
      "note": null,
      "withheld": true
    },
    "human-labels": {
      "note": null,
      "withheld": true
    },
    "implementation-logs": {
      "note": null,
      "withheld": true
    },
    "original-spec": {
      "note": null,
      "withheld": true
    },
    "repository": {
      "note": null,
      "withheld": true
    },
    "source-code": {
      "note": null,
      "withheld": true
    }
  },
  "modelSnapshot": "tutorial-deterministic-evaluator",
  "networkAllowlist": [],
  "observedMounts": [],
  "observedNetworkTargets": [],
  "observedToolCalls": [
    "release-notes-agent"
  ],
  "parentDigest": null,
  "resourceCeilings": {
    "maxCostUsd": "0.10",
    "maxInputTokens": 100000,
    "maxOutputTokens": 100000,
    "maxToolCalls": 10,
    "maxWallClockMinutes": 2
  },
  "revisionCount": 0,
  "runId": "agent-run-1",
  "schemaVersion": 1,
  "systemPromptDigest": "sha256:e2623f778b36d098c63a4b21afdc3f796234b23b62c8ddfdb34a356286862956",
  "toolAllowlist": [
    "release-notes-agent"
  ],
  "violation": null,
  "workspaceIdentity": "tutorial-workspace"
}
