{
  "actualResourceUse": {
    "costUsd": "0.01",
    "inputTokens": 900,
    "outputTokens": 150,
    "toolCalls": 5,
    "wallClockSeconds": 3
  },
  "allowedMounts": [],
  "conditionArm": "mutated",
  "contractDigest": "sha256:96a3790a4b9e291a3b1a73cb14789599916fe51f2abc2398ff02c40ee5213cf6",
  "contractId": "tutorial-notes-tool-server",
  "evaluatorConfigurationDigest": "sha256:939484df000ee54605693054e32e8180c8a8840673561f2e786455e21531e81d",
  "forbiddenInputAccounting": {
    "builder-transcript": {
      "note": null,
      "withheld": true
    },
    "comparator-results": {
      "note": null,
      "withheld": true
    },
    "human-labels": {
      "note": null,
      "withheld": true
    },
    "implementation-logs": {
      "note": null,
      "withheld": true
    },
    "original-spec": {
      "note": null,
      "withheld": true
    },
    "repository": {
      "note": null,
      "withheld": true
    },
    "source-code": {
      "note": null,
      "withheld": true
    }
  },
  "modelSnapshot": "tutorial-deterministic-evaluator",
  "networkAllowlist": [],
  "observedMounts": [],
  "observedNetworkTargets": [],
  "observedToolCalls": [
    "search_notes",
    "create_note"
  ],
  "parentDigest": null,
  "resourceCeilings": {
    "maxCostUsd": "0.25",
    "maxInputTokens": 100000,
    "maxOutputTokens": 100000,
    "maxToolCalls": 20,
    "maxWallClockMinutes": 5
  },
  "revisionCount": 0,
  "runId": "tool-run-1",
  "schemaVersion": 1,
  "systemPromptDigest": "sha256:e2623f778b36d098c63a4b21afdc3f796234b23b62c8ddfdb34a356286862956",
  "toolAllowlist": [
    "search_notes",
    "create_note"
  ],
  "violation": null,
  "workspaceIdentity": "tutorial-workspace"
}
